{
  "mova_version": "4.0.0",
  "envelope_type": "env.skill_ingest_run_request_v1",
  "envelope_id": "skill_ingest_fastapi_unified_test_run_001",
  "requested_by": "sergii-local-test",
  "skill_ingest_source_config": {
    "mova_version": "4.0.0",
    "config_id": "fastapi_unified_test",
    "name": "fastapi_unified_test",
    "description": "Smoke-test ingest for fastapi_unified_test preset.",
    "sources": [
      {
        "kind": "unified",
        "url": "https://fastapi.tiangolo.com/"
      }
    ]
  },
  "skill_ingest_run_config": {
    "mova_version": "4.0.0",
    "run_id": "skill_ingest_fastapi_unified_test_run_001",
    "mode": "scrape+package",
    "output_naming": {
      "output_name": "fastapi_unified_test",
      "output_dir": "output"
    }
  }
}
